{
  "imports": {
    "class": "imports",
    "CISCO-SMI": [
      "ciscoMgmt"
    ],
    "INET-ADDRESS-MIB": [
      "InetAddress",
      "InetAddressType",
      "InetPortNumber"
    ],
    "SNMPv2-CONF": [
      "MODULE-COMPLIANCE",
      "NOTIFICATION-GROUP",
      "OBJECT-GROUP"
    ],
    "SNMPv2-SMI": [
      "OBJECT-TYPE",
      "Counter32",
      "OBJECT-IDENTITY",
      "MibIdentifier",
      "NOTIFICATION-TYPE",
      "Unsigned32",
      "Bits",
      "Counter64",
      "IpAddress",
      "iso",
      "Gauge32",
      "Integer32",
      "MODULE-IDENTITY",
      "TimeTicks"
    ],
    "SNMPv2-TC": [
      "TEXTUAL-CONVENTION",
      "DisplayString"
    ]
  },
  "ciscoFlowMetadataMIB": {
    "name": "ciscoFlowMetadataMIB",
    "oid": "1.3.6.1.4.1.9.9.789",
    "class": "moduleidentity",
    "revisions": [
      {
        "revision": "2012-12-17 00:00",
        "description": "Deprecated CfmMetadataFlowAttrType cfmMetadataFlowAttributeTable as coupled to transport protocol. Added cfmMetadataFlowAllAttrTable decoupling it from transport protocol."
      },
      {
        "revision": "2011-03-20 00:00",
        "description": "Latest version of this MIB module."
      }
    ],
    "lastupdated": "201212200000Z",
    "organization": "Cisco Systems, Inc.",
    "contactinfo": "Cisco Systems Customer Service Postal: 170 W Tasman Drive San Jose, CA 95134 USA Tel: +1 800 553-NETS E-mail: cs-medianet-metadata@cisco.com",
    "description": "The MIB module for managing Cisco medianet flow metadata. Metadata, in the simplest form, is data that qualifies other data. Flow metadata is data that describes a flow in the network. Metadata plays an important role in providing a framework, that makes data from one component available to another component on the same network element as well as across other network elements. MIB Table Overview: =================== This MIB consists of two tables: 1) cfmMetadataFlowTable 2) cfmMetadataFlowAttrTable cfmMetadataFlowTable provides the details about the six tuple which can uniquely identify a network traffic flow. cfmMetadataFlowAttrTable will specify flow attributes carried in the metadata flow. Flow attribute values are represented in 'Type-Value' format. cfmMetadataFlowAttrType - Represent the type of flow attribute. cfmMetadataFlowAttrValue - Represent corresponding flow attribute value. cfmMetadataFlowTable and cfmMetadataFlowAttrTable are linked together using flow ID which will map respective metadata flow attributes with the corresponding flow key."
  },
  "CfmMetadataFlowAttributeType": {
    "name": "CfmMetadataFlowAttributeType",
    "class": "textualconvention",
    "type": {
      "type": "INTEGER",
      "class": "type",
      "constraints": {
        "enumeration": {
          "other": 0,
          "appDescription": 94,
          "appTag": 95,
          "appName": 96,
          "appVersion": 97,
          "appVendor": 98,
          "vmFlowTimeout": 100,
          "vmRTPClockFrequency": 101,
          "pakRate": 103,
          "l3Bitrate": 104,
          "mediaBitrate": 105,
          "mediaVideoPaksize": 106,
          "globalSessionID": 107,
          "multipartySessionID": 108,
          "rtpMediaFlow": 109,
          "mediaEncryptionStatus": 110,
          "syntheticTraffic": 111,
          "meteringPriority": 112,
          "endpointModel": 113,
          "endpointVendor": 114,
          "endpointVersion": 115,
          "ssrc": 116,
          "endpointIPAddressType": 117,
          "endpointIPAddressLength": 118,
          "endpointIPAddressValue": 119,
          "sipProxyServerType": 120,
          "sipProxyServerLength": 121,
          "sipProxyServerValue": 122,
          "bandwidth": 123,
          "deviceName": 124,
          "deviceClass": 125,
          "sipUserName": 126,
          "sipEmail": 127,
          "audioCodec": 128,
          "bandwidthConsumed": 129,
          "payloadType": 130,
          "mimeType": 131,
          "extrapolatedBandwidth": 132,
          "cname": 134,
          "videoCodec": 135,
          "sdpSessionID": 136,
          "domainName": 137,
          "endpointSwVersion": 138,
          "tosDscp": 139
        }
      }
    },
    "status": "deprecated",
    "description": "This object specifies the attributes types that is applicable to a given flow. The following are the entire possible metadata attribute types and a brief explanation for the same. other(0) - Other attribute types than listed below. appDescription(94) - Application description of the the flow. It is represented as a string of length 55 characters. appTag(95) - Application tag value of the flow. It is represented as unsigned32. appName(96) - Application name of the flow. It is represented as a string of length 24 characters. appVersion(97) - Application version of the flow. It is represented as a string of length 40 characters. appVendor(98) - Application vendor of the flow. It is represented as a string of length 40 characters. vmFlowTimeout(100) - Flow time out value of the flow. It is represented as unsigned32. vmRTPClockFrequency(101) - Clock frequency of the flow. It is represented as unsigned32. pakrate(103) - Packet rate of the flow. It is represented as unsigned64. l3Bitrate(104) - L3 bit rate of the flow. It is represented as unsigned32. mediaBitrate(105) - Media bit rate of the flow. It is represented as unsigned32. mediaVideoPaksize(106) - Media video bit rate of the flow. It is represented as unsigned32. globalSessionID(107) - Global session ID of the flow.It is represented as a string of length 80 characters. multipartySessionID(108) - Multi party session ID of the flow. It is represented as a string of length 80 characters. rtpMediaFlow(109) - RTP media flow attribute of the flow. It is represented as uint8. mediaEncryptionStatus(110) - Media encryption status of the flow. It is represented as uint8. syntheticTraffic(111) - Synthetic traffic represented as uint8. meteringPriority(112) - Metering Priority of the flow. It is represented as uint8. endpointModel(113) - Endpoint device model signaling the flow. It is represented as string of 40 characters length. endpointVendor(114) - Endpoint device vendor signaling the flow. It is represented as string of 40 characters length. endpointVersion(115) - Endpoint device version signaling the flow. It is represented as string of 40 characters length. ssrc(116) - Synchronization source of the flow. It is represented as uint32. endpointIPAddressType(117) - IP address type of the endpoint device signaling the flow. It is represented as uint8. endpointIPAddressLength(118) - IP address length of the endpoint device signaling the flow. It is represented as uint8. endpointIPAddressValue(119) - IP address of the endpoint device signaling the flow. It is represented as a string of 16 characters length. sipProxyServerType(120) - SIP proxy server IP address type of the flow. It is represented as uint8. sipProxyServerLength(121) - SIP proxy server IP address length of the flow. It is represented as uint8. sipProxyServerValue(122) - SIP proxy server IP address of the flow. It is represented as a string of 16 characters length. bandwidth(123) - Bandwidth of the flow. It is represented as uint32. deviceName(124) - Endpoint device name signaling the flow. It is represented as a string of 100 characters length. deviceClass(125) - Endpoint device class signaling the flow. It is represented as a string of 100 characters length. sipUserName(126) - SIP flow user name. It is represented as a string of 16 characters length. sipEmail(127) - SIP flow email ID. It is represented as a string of 24 characters length. audioCodec(128) - Audio codec of the flow. It is represented as uint8. bandwidthConsumed(129) - Bandwidth consumed of the flow. It is represented as uint32. payloadType(130) - Payload type of the flow. It is represented as uint8. mimeType(131) - MIME type of the flow. It is represented as a string of 16 characters length. extrapolatedBandwidth(132) - Extrapolated bandwidth of the flow. It is represented as uint32. cname(134) - cname of the flow. It is represented as a string of 24 characters in length. videoCodec(135) - Video codec of the flow. It is represented as uint8. sdpSessionID(136) - SDP session ID of the flow. It is represented as a string of 80 characters length. domainName(137) - Domain name of the flow. It is represented as a string of 24 characters length. endpointSwVersion(138) - Software version of the endpoint device signaling the flow. It is represented as a string of 24 characters length. tosDscp(139) - Tos/Dscp value of the flow. It is represented as uint8. This textual-convention and objects of this type have been deprecated as no longer needed. CfmMetadataFlowAttributeType object is superseded by cfmMetadataFlowAllAttrValue."
  },
  "CfmMetadataFlowAttrVal": {
    "name": "CfmMetadataFlowAttrVal",
    "class": "textualconvention",
    "type": {
      "type": "OCTET STRING",
      "class": "type",
      "constraints": {
        "size": [
          {
            "min": 1,
            "max": 255
          }
        ]
      }
    },
    "status": "deprecated",
    "description": "This textual convention denotes a value to be used with 'cfmMetadataFlowAttributeType'. A ' CfmMetadataFlowAttrVal ' is always interpreted within the context of cfmMetadataFlowAttrEntry. Every usage of the ' CfmMetadataFlowAttrVal' textual convention is required to specify the ' CfmMetadataFlowAttributeType ' object. CfmMetadataFlowAttrVal object is deprecated as no longer needed."
  },
  "cFlowMetadataMIBNotifs": {
    "name": "cFlowMetadataMIBNotifs",
    "oid": "1.3.6.1.4.1.9.9.789.0",
    "class": "objectidentity"
  },
  "cFlowMetadataMIBObjects": {
    "name": "cFlowMetadataMIBObjects",
    "oid": "1.3.6.1.4.1.9.9.789.1",
    "class": "objectidentity"
  },
  "cFlowMetadataMIBConform": {
    "name": "cFlowMetadataMIBConform",
    "oid": "1.3.6.1.4.1.9.9.789.2",
    "class": "objectidentity"
  },
  "cfmMetadataFlowTable": {
    "name": "cfmMetadataFlowTable",
    "oid": "1.3.6.1.4.1.9.9.789.1.1",
    "nodetype": "table",
    "class": "objecttype",
    "maxaccess": "not-accessible",
    "status": "current",
    "description": "A list of 6-tuple and flow id that is used to identify the metadata flows."
  },
  "cfmMetadataFlowEntry": {
    "name": "cfmMetadataFlowEntry",
    "oid": "1.3.6.1.4.1.9.9.789.1.1.1",
    "nodetype": "row",
    "class": "objecttype",
    "maxaccess": "not-accessible",
    "indices": [
      {
        "module": "CISCO-FLOW-METADATA-MIB",
        "object": "cfmMetadataFlowId",
        "implied": 0
      }
    ],
    "status": "current",
    "description": "An entry containing the flow id and the 6-tuple which is used as a key to uniquely identify a metadata flow ."
  },
  "cfmMetadataFlowId": {
    "name": "cfmMetadataFlowId",
    "oid": "1.3.6.1.4.1.9.9.789.1.1.1.1",
    "nodetype": "column",
    "class": "objecttype",
    "syntax": {
      "type": "Unsigned32",
      "class": "type"
    },
    "maxaccess": "not-accessible",
    "status": "current",
    "description": "ID that uniquely identifies this metadata flow. It is dynamically generated once the flow key information is available and assigned to the flow."
  },
  "cfmMetadataFlowProtocolType": {
    "name": "cfmMetadataFlowProtocolType",
    "oid": "1.3.6.1.4.1.9.9.789.1.1.1.2",
    "nodetype": "column",
    "class": "objecttype",
    "syntax": {
      "type": "INTEGER",
      "class": "type",
      "constraints": {
        "enumeration": {
          "tcp": 1,
          "udp": 2
        }
      }
    },
    "maxaccess": "read-only",
    "status": "current",
    "description": "The protocol type of this metadata flow."
  },
  "cfmMetadataFlowDestAddrType": {
    "name": "cfmMetadataFlowDestAddrType",
    "oid": "1.3.6.1.4.1.9.9.789.1.1.1.3",
    "nodetype": "column",
    "class": "objecttype",
    "syntax": {
      "type": "InetAddressType",
      "class": "type"
    },
    "maxaccess": "read-only",
    "status": "current",
    "description": "The type of destination Internet address of this metadata flow."
  },
  "cfmMetadataFlowDestAddr": {
    "name": "cfmMetadataFlowDestAddr",
    "oid": "1.3.6.1.4.1.9.9.789.1.1.1.4",
    "nodetype": "column",
    "class": "objecttype",
    "syntax": {
      "type": "InetAddress",
      "class": "type"
    },
    "maxaccess": "read-only",
    "status": "current",
    "description": "The destination Internet address of this metadata flow. The type of this address is determined by the value of cfmMetadataFlowDestAddrType."
  },
  "cfmMetadataFlowDestPort": {
    "name": "cfmMetadataFlowDestPort",
    "oid": "1.3.6.1.4.1.9.9.789.1.1.1.5",
    "nodetype": "column",
    "class": "objecttype",
    "syntax": {
      "type": "InetPortNumber",
      "class": "type"
    },
    "maxaccess": "read-only",
    "status": "current",
    "description": "The destination port of this metadata flow."
  },
  "cfmMetadataFlowSrcAddrType": {
    "name": "cfmMetadataFlowSrcAddrType",
    "oid": "1.3.6.1.4.1.9.9.789.1.1.1.6",
    "nodetype": "column",
    "class": "objecttype",
    "syntax": {
      "type": "InetAddressType",
      "class": "type"
    },
    "maxaccess": "read-only",
    "status": "current",
    "description": "The type of source Internet address of this metadata flow."
  },
  "cfmMetadataFlowSrcAddr": {
    "name": "cfmMetadataFlowSrcAddr",
    "oid": "1.3.6.1.4.1.9.9.789.1.1.1.7",
    "nodetype": "column",
    "class": "objecttype",
    "syntax": {
      "type": "InetAddress",
      "class": "type"
    },
    "maxaccess": "read-only",
    "status": "current",
    "description": "The source Internet address of this metadata flow. The type of this address is determined by the value of cfmMetadataFlowSrcAddrType."
  },
  "cfmMetadataFlowSrcPort": {
    "name": "cfmMetadataFlowSrcPort",
    "oid": "1.3.6.1.4.1.9.9.789.1.1.1.8",
    "nodetype": "column",
    "class": "objecttype",
    "syntax": {
      "type": "InetPortNumber",
      "class": "type"
    },
    "maxaccess": "read-only",
    "status": "current",
    "description": "The source port of this metadata flow."
  },
  "cfmMetadataFlowSSRC": {
    "name": "cfmMetadataFlowSSRC",
    "oid": "1.3.6.1.4.1.9.9.789.1.1.1.9",
    "nodetype": "column",
    "class": "objecttype",
    "syntax": {
      "type": "Unsigned32",
      "class": "type",
      "constraints": {
        "range": [
          {
            "min": 0,
            "max": 4294967295
          }
        ]
      }
    },
    "maxaccess": "read-only",
    "status": "current",
    "description": "The Synchronization Source Identifier (SSRC) of this metadata flow."
  },
  "cfmMetadataFlowAttrTable": {
    "name": "cfmMetadataFlowAttrTable",
    "oid": "1.3.6.1.4.1.9.9.789.1.2",
    "nodetype": "table",
    "class": "objecttype",
    "maxaccess": "not-accessible",
    "status": "deprecated",
    "description": "A list of metadata flows and their additional attribute parameters. cfmMetadataFlowAttrTable object is superseded by cfmMetadataFlowAttribTable."
  },
  "cfmMetadataFlowAttrEntry": {
    "name": "cfmMetadataFlowAttrEntry",
    "oid": "1.3.6.1.4.1.9.9.789.1.2.1",
    "nodetype": "row",
    "class": "objecttype",
    "maxaccess": "not-accessible",
    "indices": [
      {
        "module": "CISCO-FLOW-METADATA-MIB",
        "object": "cfmMetadataFlowId",
        "implied": 0
      },
      {
        "module": "CISCO-FLOW-METADATA-MIB",
        "object": "cfmMetadataFlowAttrType",
        "implied": 0
      }
    ],
    "status": "deprecated",
    "description": "An entry containing additional attribute parameter for a particular metadata flow. cfmMetadataFlowAttrEntry object is superseded by cfmMetadataFlowAttribEntry."
  },
  "cfmMetadataFlowAttrType": {
    "name": "cfmMetadataFlowAttrType",
    "oid": "1.3.6.1.4.1.9.9.789.1.2.1.1",
    "nodetype": "column",
    "class": "objecttype",
    "syntax": {
      "type": "CfmMetadataFlowAttributeType",
      "class": "type"
    },
    "maxaccess": "read-only",
    "status": "deprecated",
    "description": "The attribute type applicable to a given metadata flow. The attribute types are explained in CfmMetadataFlowAttrType. cfmMetadataFlowAttrType object is superseded by cfmMetadataIpFixIeId."
  },
  "cfmMetadataFlowAttrValue": {
    "name": "cfmMetadataFlowAttrValue",
    "oid": "1.3.6.1.4.1.9.9.789.1.2.1.2",
    "nodetype": "column",
    "class": "objecttype",
    "syntax": {
      "type": "CfmMetadataFlowAttrVal",
      "class": "type"
    },
    "maxaccess": "read-only",
    "status": "deprecated",
    "description": "The attribute value associated with the attribute type of a given metadata flow. cfmMetadataFlowAttrValue object is superseded by cfmMetadataFlowAttribValue."
  },
  "cfmMetadataFlowAllAttrTable": {
    "name": "cfmMetadataFlowAllAttrTable",
    "oid": "1.3.6.1.4.1.9.9.789.1.3",
    "nodetype": "table",
    "class": "objecttype",
    "maxaccess": "not-accessible",
    "status": "current",
    "description": "A list of metadata flows and their additional attribute parameters."
  },
  "cfmMetadataFlowAllAttrEntry": {
    "name": "cfmMetadataFlowAllAttrEntry",
    "oid": "1.3.6.1.4.1.9.9.789.1.3.1",
    "nodetype": "row",
    "class": "objecttype",
    "maxaccess": "not-accessible",
    "indices": [
      {
        "module": "CISCO-FLOW-METADATA-MIB",
        "object": "cfmMetadataFlowId",
        "implied": 0
      },
      {
        "module": "CISCO-FLOW-METADATA-MIB",
        "object": "cfmMetadataIpFixIeId",
        "implied": 0
      },
      {
        "module": "CISCO-FLOW-METADATA-MIB",
        "object": "cfmMetadataFlowAllAttrInstanceId",
        "implied": 0
      }
    ],
    "status": "current",
    "description": "An entry containing additional attribute parameter for a particular metadata flow."
  },
  "cfmMetadataIpFixIeId": {
    "name": "cfmMetadataIpFixIeId",
    "oid": "1.3.6.1.4.1.9.9.789.1.3.1.1",
    "nodetype": "column",
    "class": "objecttype",
    "syntax": {
      "type": "Unsigned32",
      "class": "type",
      "constraints": {
        "range": [
          {
            "min": 0,
            "max": 65535
          }
        ]
      }
    },
    "maxaccess": "not-accessible",
    "status": "current",
    "description": "The attribute IPFix IE-ID associated with the attribute of a given metadata flow. Logically, IE-ID is only 15 bits, but in existing transports, such as the actual IPFIX transport protocol, and Cisco metadata signaling in RSVP, the IE-ID is encoded as a uint16. If the high-order bit is 0, then it indicates that VendorID is 0 (IANA = IETF standardized attributes)."
  },
  "cfmMetadataFlowAllAttrInstanceId": {
    "name": "cfmMetadataFlowAllAttrInstanceId",
    "oid": "1.3.6.1.4.1.9.9.789.1.3.1.2",
    "nodetype": "column",
    "class": "objecttype",
    "syntax": {
      "type": "Unsigned32",
      "class": "type",
      "constraints": {
        "range": [
          {
            "min": 0,
            "max": 2147483647
          }
        ]
      }
    },
    "maxaccess": "not-accessible",
    "status": "current",
    "description": "The attribute arbitrary instance, assigned locally by the implementation, associated with the attribute IPFix IE-ID of a given metadata flow."
  },
  "cfmMetadataFlowAllAttrValue": {
    "name": "cfmMetadataFlowAllAttrValue",
    "oid": "1.3.6.1.4.1.9.9.789.1.3.1.3",
    "nodetype": "column",
    "class": "objecttype",
    "syntax": {
      "type": "OCTET STRING",
      "class": "type",
      "constraints": {
        "size": [
          {
            "min": 0,
            "max": 255
          }
        ]
      }
    },
    "maxaccess": "read-only",
    "status": "current",
    "description": "The attribute value associated with the attribute IPFix IE-ID of a given metadata flow."
  },
  "cfmMetadataFlowAllAttrPen": {
    "name": "cfmMetadataFlowAllAttrPen",
    "oid": "1.3.6.1.4.1.9.9.789.1.3.1.4",
    "nodetype": "column",
    "class": "objecttype",
    "syntax": {
      "type": "Unsigned32",
      "class": "type",
      "constraints": {
        "range": [
          {
            "min": 0,
            "max": 2147483647
          }
        ]
      }
    },
    "maxaccess": "read-only",
    "reference": "http://www.iana.org/assignments/enterprise-numbers",
    "status": "current",
    "description": "The attribute IANA Private Enterprise Number associated with vendor for the attribute IPFix IE-ID of a given metadata flow."
  },
  "cfmMetadataMIBCompliances": {
    "name": "cfmMetadataMIBCompliances",
    "oid": "1.3.6.1.4.1.9.9.789.2.1",
    "class": "objectidentity"
  },
  "cfmMetadataMIBGroups": {
    "name": "cfmMetadataMIBGroups",
    "oid": "1.3.6.1.4.1.9.9.789.2.2",
    "class": "objectidentity"
  },
  "cfmMetadataMIBCompliance": {
    "name": "cfmMetadataMIBCompliance",
    "oid": "1.3.6.1.4.1.9.9.789.2.1.1",
    "class": "modulecompliance",
    "modulecompliance": [
      {
        "object": "cfmMetadateFlowInfoGroup",
        "module": "CISCO-FLOW-METADATA-MIB"
      }
    ],
    "status": "deprecated",
    "description": "The compliance statement for the CISCO-FLOW-METADATA-MIB."
  },
  "cfmMetadataMIBComplianceV2": {
    "name": "cfmMetadataMIBComplianceV2",
    "oid": "1.3.6.1.4.1.9.9.789.2.1.2",
    "class": "modulecompliance",
    "modulecompliance": [
      {
        "object": "cfmMetadateFlowInfoGroupV2",
        "module": "CISCO-FLOW-METADATA-MIB"
      }
    ],
    "status": "current",
    "description": "The compliance statement for the CISCO-FLOW-METADATA-MIB."
  },
  "cfmMetadateFlowInfoGroup": {
    "name": "cfmMetadateFlowInfoGroup",
    "oid": "1.3.6.1.4.1.9.9.789.2.2.1",
    "class": "objectgroup",
    "objects": [
      {
        "module": "CISCO-FLOW-METADATA-MIB",
        "object": "cfmMetadataFlowProtocolType"
      },
      {
        "module": "CISCO-FLOW-METADATA-MIB",
        "object": "cfmMetadataFlowDestAddrType"
      },
      {
        "module": "CISCO-FLOW-METADATA-MIB",
        "object": "cfmMetadataFlowDestAddr"
      },
      {
        "module": "CISCO-FLOW-METADATA-MIB",
        "object": "cfmMetadataFlowDestPort"
      },
      {
        "module": "CISCO-FLOW-METADATA-MIB",
        "object": "cfmMetadataFlowSrcAddrType"
      },
      {
        "module": "CISCO-FLOW-METADATA-MIB",
        "object": "cfmMetadataFlowSrcAddr"
      },
      {
        "module": "CISCO-FLOW-METADATA-MIB",
        "object": "cfmMetadataFlowSrcPort"
      },
      {
        "module": "CISCO-FLOW-METADATA-MIB",
        "object": "cfmMetadataFlowSSRC"
      },
      {
        "module": "CISCO-FLOW-METADATA-MIB",
        "object": "cfmMetadataFlowAttrType"
      },
      {
        "module": "CISCO-FLOW-METADATA-MIB",
        "object": "cfmMetadataFlowAttrValue"
      }
    ],
    "status": "deprecated",
    "description": "A collection of objects which provide metadata flow information. cfmMetadateFlowInfoGroup object is superseded by cfmMetadateFlowInfoGroupV2."
  },
  "cfmMetadateFlowInfoGroupV2": {
    "name": "cfmMetadateFlowInfoGroupV2",
    "oid": "1.3.6.1.4.1.9.9.789.2.2.2",
    "class": "objectgroup",
    "objects": [
      {
        "module": "CISCO-FLOW-METADATA-MIB",
        "object": "cfmMetadataFlowProtocolType"
      },
      {
        "module": "CISCO-FLOW-METADATA-MIB",
        "object": "cfmMetadataFlowDestAddrType"
      },
      {
        "module": "CISCO-FLOW-METADATA-MIB",
        "object": "cfmMetadataFlowDestAddr"
      },
      {
        "module": "CISCO-FLOW-METADATA-MIB",
        "object": "cfmMetadataFlowDestPort"
      },
      {
        "module": "CISCO-FLOW-METADATA-MIB",
        "object": "cfmMetadataFlowSrcAddrType"
      },
      {
        "module": "CISCO-FLOW-METADATA-MIB",
        "object": "cfmMetadataFlowSrcAddr"
      },
      {
        "module": "CISCO-FLOW-METADATA-MIB",
        "object": "cfmMetadataFlowSrcPort"
      },
      {
        "module": "CISCO-FLOW-METADATA-MIB",
        "object": "cfmMetadataFlowSSRC"
      },
      {
        "module": "CISCO-FLOW-METADATA-MIB",
        "object": "cfmMetadataFlowAllAttrValue"
      },
      {
        "module": "CISCO-FLOW-METADATA-MIB",
        "object": "cfmMetadataFlowAllAttrPen"
      }
    ],
    "status": "current",
    "description": "A collection of objects which provide metadata flow information."
  },
  "meta": {
    "comments": [
      "ASN.1 source file://MIBS/asn1/CISCO-FLOW-METADATA-MIB.mib",
      "Produced by pysmi-0.3.4 at Tue Apr 20 18:31:25 2021",
      "On host samy-ThinkPad-T495s platform Linux version 5.8.0-50-generic by user root",
      "Using Python version 3.8.5 (default, Jan 27 2021, 15:41:15) "
    ],
    "module": "CISCO-FLOW-METADATA-MIB"
  }
}